{
  "type": "object",
  "properties": {
    "schema_revision": {
      "const": "0.1.0"
    },
    "name": {
      "type": "string",
      "minLength": 1
    },
    "version": {
      "type": "string",
      "minLength": 1
    },
    "description": {
      "type": "string",
      "minLength": 1
    },
    "side_effects": {
      "type": "boolean"
    },
    "parameters": {
      "type": "object"
    },
    "implementation_kind": {
      "enum": [
        "native",
        "reimplementation",
        "approximation",
        "mock"
      ]
    }
  },
  "required": [
    "schema_revision",
    "name",
    "version",
    "description",
    "side_effects",
    "parameters",
    "implementation_kind"
  ],
  "additionalProperties": false,
  "$schema": "https://json-schema.org/draft/2020-12/schema",
  "$id": "urn:rsagent:tool:0.1.0"
}
